servico,texto,autor,usuario,data,curtidas,comentarios,tipo,sentimento
Cleric,"I'll just not think about it too hard and jump into it:  1. Tempus: Battle Master Fighter 2. Umberlee: Tempest Domain Cleric 3. Correlon: Fey Wanderer Ranger, college of swords bard, bladesinger wizard 4. Mask: Rogue Thief 5. Malar: Hunter Ranger, beast barbarian 6. Shar: Illusion wizard, shadow sorcerer, warlock 7. Kelemvor: Grave Domain Cleric 8. Baal: Assassin Rogue 9. Bane: Champion Fighter 10. Myrkul: Necromancer Wizard 11. Ohgma: Loremaster Wizard 12. Silvanus: Circle of the Land Druid 13.",sir_schuster1,u/sir_schuster1,2025-09-11T13:22:11,1,0,comentario,Neutro
Cleric,I have Chosen as something more like a “template”.,MissAnnTropez,u/MissAnnTropez,2025-09-11T22:16:19,1,0,comentario,Neutro
Cleric,"It is an idea of speciality priest in 2e.  Obviously Mielikki would choose Ranger, probably Beast Master with unicorn companion?",AdAdditional1820,u/AdAdditional1820,2025-09-12T02:38:36,1,0,comentario,Neutro
Cleric,Mask had a swordmage and an assasin,Agreeable_Dingo_5766,u/Agreeable_Dingo_5766,2025-09-15T17:44:43,1,0,comentario,Neutro
Cleric,"Question about gods, devils and their rights to souls Came here after BG3 and I would like to clarify a few things because I am confused. I don't know much about DnD lore, but as far as I know there is a Primeval Pact where devils can take the souls of people who made a deal with them and the gods agreed to it so they can have an army against the demons.  First of all, I would like to clarify some points from the game, is this just a liberty on the part of the developers? So as far as I know the",PrimalRoar332,u/PrimalRoar332,2025-09-11T09:59:35,15,14,post,Neutro
Cleric,"Well, *normally* gods don't interfere with Pimeval Pacts. But in case of very special mortals/Chosen Ones, devils let one soul go with understanding that this particular god will owe them a favor later. Basically, gods are casting a tiny Divine Intervention here that can circumvent all normal pacts and agreements, and as usual, ""might makes right"" in FR.",Sunny_Hill_1,u/Sunny_Hill_1,2025-09-11T10:08:24,17,0,comentario,Neutro
Cleric,"Deities cannot override the Pact Primeval. Your soul belongs to the devil.   It's been addressed in a few books both crunch and fluff, but unless taken to trial, the devil always wins. It's because the Pact is based on primordial Law, which trumps every non-overdeity. In practice, it'd be a negotiation. Gale can offer something to Myzora, or if Myzora sold the contract to Zariel, and I can't imagine they wouldn't negotiate with him as a deity's favor is more valuable. Gale *could* attempt to for",Baro-Llyonesse,u/Baro-Llyonesse,2025-09-11T11:07:51,8,0,comentario,Neutro
Cleric,"The Pact Primeval is one of the multiple choice answers for a possible origin of the Dark Lord of Nessus. The gods themselves don't really meddle much in the Blood War; the fiends don't care for divine meddling and the last time the gods decided to wade into the whole mess, a deity of chaos was murdered by the yugoloths to get the gods to back off.   Generally speaking, swearing your soul to two different masters is grounds for a god to tell you where you can stuff your duplicity. Yes, they can ",LordofBones89,u/LordofBones89,2025-09-11T10:09:21,7,0,comentario,Neutro
Cleric,"Theres definitely lore experts who can clarify and explain things better than me, but what I will put forth is that while BG3 is a fantastic game, it has some inaccuracies to proper FR cannon, and can be seen in some places supporting more generic 5e lore than traditional FR lore. It gets a lot correct, but I couldn't in good faith say that its the best source to understand the setting   Wyll and Gale specifically have a lot of creative interpretation in his things work respectively for them. Ka",Nystagohod,u/Nystagohod,2025-09-11T10:10:26,4,0,comentario,Satisfeito
Cleric,"The way I play it (and this may vary from canon) is that there are some restrictions on when and how a devil can exercise their claim on a soul.  If the soul is dead and ends up on the fugue plane, it's clearly marked as the property of the bargaining fiend. The soul will then be sent into a collection area for the fiend or their representative to collect it at their leisure.  I've interpreted ceremorphosis (the process of becoming an illithid) as a battle between the tadpole's soul core truth, ",MageKorith,u/MageKorith,2025-09-11T10:41:15,2,0,comentario,Neutro
Cleric,"Revised Deities (3.5e): Kanchelsis, the Eternal Elder Vampire With thanks to Aulddragon.  **KANCHELSIS**   *Lord of Vampires, the Vampire King, the Eternal Elder Vampire, the Rake, the Beast, the First Vampire*   **Intermediate Power of the Abyss**   **Symbol** Bat with glowing red eyes   **Realm** Lair of the Beast or Mansion of the Rake (Abyss/487^(th))   **Alignment** Chaotic Evil   **Aliases** Maastracht   **Superior** none   **Allies** Afflux, Doresain, Eshebala, , Graz’zt, Keptolo, Lolth, ",LordofBones89,u/LordofBones89,2025-09-05T23:51:26,14,2,post,Satisfeito
Cleric,Isn't Kanchy from Greyhawk?,ThanosofTitan92,u/ThanosofTitan92,2025-09-06T21:42:43,1,0,comentario,Neutro
Cleric,It's not clear where Kanchy is actually worshipped. He's a multispheric deity and he's apparently so infamous that even Ravenloft's vampires fear and respect him. I'd assume that he's well-known enough among the older vampires of the Realms. The undead gods like Mellifleur and Kanchelsis seem to gain power and influence from the creation and actions of liches and vampires rather than actual formal worship (Kanchy IIRC has no formal priesthood but is still the same rank of deity as Lolth).  But h,LordofBones89,u/LordofBones89,2025-09-06T21:58:20,2,0,comentario,Neutro
