servico,texto,autor,usuario,data,curtidas,comentarios,tipo,sentimento
Detran,"Já aconteceu isso com vocês? Fiz a prova do detran hoje, tive vários problemas com um dos avaliadores e teve divergência entre os dois por que um queria aprovação e o outro reprovação. Aí me explicaram que quando é assim vai pra banca avaliadora.    Agora saiu o resultado e tá constando no documento Situação : 0305 - Aprovado no exame pratico 4 rodas (Pendencia na atualização da BCA)  Mas no site quando procuro o resultado do renarch está reprovado  Esse documento foi a auto escola que me mandou",Emokidsucks,u/Emokidsucks,2025-08-29T21:13:39,11,1,post,Neutro
Detran,Você tentou ligar pro detran? A pesquisa rápida indica que isso significa que o detran ainda não processou o resultado para passar pro banco nacional de motorista então pode ser que só precisa esperar atualizar,random_BA,u/random_BA,2025-08-29T21:41:25,10,0,comentario,Neutro
Detran,"Em era de Pix, cartórios ainda existem e faturam 30 bi/ano Matéria do UOL:  [https://tab.uol.com.br/noticias/redacao/2025/08/11/dou-fe-para-que-servem-os-cartorios-mercado-de-mais-de-r-30-bilhoes.htm](https://tab.uol.com.br/noticias/redacao/2025/08/11/dou-fe-para-que-servem-os-cartorios-mercado-de-mais-de-r-30-bilhoes.htm)  Highlights (artigo pago):   no Brasil:   \- Registros civis, de imóveis e atos notariais passam por cartórios privados   \- donos de cartórios recebem até 156 mil/mês. No DF ",Puzzleheaded_Ball141,u/Puzzleheaded_Ball141,2025-08-11T13:27:22,40,16,post,Satisfeito
Detran,"Atestado de óbito poderia ser feito pelo INSS, já fazem a prova de vida, iria facilitar ",Guilty_Locksmith_892,u/Guilty_Locksmith_892,2025-08-11T13:52:45,9,0,comentario,Neutro
Detran,"Tem três vias para acabar com isso. Argumentar que só interessa as classes dominantes (PT), é uma intervenção desnecessária do estado na economia (PSD, MDB e partidos de centro que são racionais) e que beneficia comunistas (Bolsonaristas)",Guilty_Locksmith_892,u/Guilty_Locksmith_892,2025-08-11T13:40:13,15,0,comentario,Neutro
Detran,É uma verdadeira máfia. No interior da minha família tem uma cidadã que controla o cartório há várias décadas.,eidbio,u/eidbio,2025-08-11T19:32:15,3,0,comentario,Neutro
Detran,Quais partidos já se posicionaram ou tomaram medidas que diminuem/eliminam a necessidade de cartórios?,Good-Aardvark9900,u/Good-Aardvark9900,2025-08-11T14:57:53,2,0,comentario,Neutro
Detran,"O equivalente da Receita Federal na Suécia ganha todo ano nas pesquisas de opinião de qual órgão estatal o cidadão confia mais. É impensável algo parecido num lugar onde a população é ensinada a desconfiar do governo e odiar pagar imposto. Na Suécia o cara que quer disponibilizar o imóvel no Airbnb só comunica a receita e eles cuidam de tudo.   O Pix foi um passo na direção certa, mas pra chegar nesse nível vai demorar muito ainda.",RodsNtt,u/RodsNtt,2025-08-11T16:56:13,2,0,comentario,Neutro
Detran,"Moraes proíbe acampamentos na Praça dos Três Poderes ""O ministro Alexandre de Moraes, do Supremo Tribunal Federal (STF), proibiu a instalação de acampamentos ou qualquer forma de obstrução na Praça dos Três Poderes, em Brasília. (...)  Na decisão, Moraes acatou pedido da Procuradoria-Geral da República e alertou que os atos tinham o potencial de coagir ministros do STF e interferir no andamento de julgamentos sensíveis, como os que envolvem o ex-presidente Bolsonaro e aliados. Além de proibir ac",SineMemoria,u/SineMemoria,2025-07-26T11:01:47,271,19,post,Satisfeito
Detran,"Acho lindo o título, fica parecendo que o Moraes tirou a decisão da cabeça dele.  Podiam colocar ""Moares acata pedido da PGR"" ou ""STF acata pedido da PGR"".",Aburamy,u/Aburamy,2025-07-26T11:52:00,126,0,comentario,Neutro
Detran,"Agr vão chorar falando q o Moraes tá censurando o protesto deles kkkkkkkkkkjkkkkkk   Vtnc, td na mão da direita vira arma de controle de massa...",LordlTsuki,u/LordlTsuki,2025-07-26T11:32:25,38,0,comentario,Neutro
Detran,Pela constituição o Ibaneis (gov do DF) deveria garantir a segurança e zelar pelos poderes sediados em Brasília.  Inclusive recebe uma mesada de 25 BILHÕES DE REAIS para cobrir as despesas.  NOVAMENTE não cumpre obrigação constitucional. Sonho dele é ter outro 8 de janeiro?,Snatchpd,u/Snatchpd,2025-07-26T13:15:23,9,0,comentario,Neutro
Detran,nao é casa da mãe joana nao! vao acampar na frente da casa do minto! vao fazer baderna e sujeira lá no condominio fechado dele kkkkkkkkkkk,Desconhecido,u/Desconhecido,2025-07-26T11:59:35,5,0,comentario,Neutro
Detran,"Discordo do Prezado. Também ao fim do cardápio via qrcode, pode banir do Brasil.",rodrigoriosx,u/rodrigoriosx,2025-07-17T12:14:20,1576,211,post,Neutro
Detran,Faltou o PL,HotBit1109,u/HotBit1109,2025-07-17T12:18:08,351,0,comentario,Neutro
Detran,"Tem que acabar com a ""Gourmetização"" dos fast-foods!  Cadê os podrão completo por 10 conto? Agora é só ""hamburguer artesanal"" de 40 conto pra cima",tsd-will,u/tsd-will,2025-07-17T12:17:28,323,0,comentario,Satisfeito
Detran,"Tem que acabar tbm os mesacasts, reacts e ragebaits",Wallac95,u/Wallac95,2025-07-17T12:46:22,72,0,comentario,Neutro
Detran,"Tirando a receita federal, apoiado",Fernando1987_,u/Fernando1987_,2025-07-17T12:19:49,156,0,comentario,Neutro
Detran,Cardapio por qr code é muita esquizofrenia pqp.,Forsaken_Stomach5130,u/Forsaken_Stomach5130,2025-07-17T13:27:07,27,0,comentario,Neutro
Detran,"Aluna chega dirigindo para prova do Detran e leva multa de R$ 880,40",Bananey,u/Bananey,2025-07-15T21:18:40,136,12,post,Neutro
Detran,ponto na carteira não perde.,monochrome-unicorn,u/monochrome-unicorn,2025-07-15T21:27:24,97,0,comentario,Neutro
Detran,Detran implica com cada coisinha /s,Bananey,u/Bananey,2025-07-15T21:18:55,79,0,comentario,Neutro
Detran,Mas conseguiu fazer a prova?,SheeshDudeBruh,u/SheeshDudeBruh,2025-07-15T23:06:12,15,0,comentario,Neutro
Detran,"Quando eu estava fazendo minhas aulas teóricas, uns 70% da turma tinha mais de 30 anos e todos chegavam de moto",Oakcamp,u/Oakcamp,2025-07-16T07:51:57,1,0,comentario,Neutro
Detran,Quero saber como ela voltou pra casa.,nakabra,u/nakabra,2025-07-16T11:12:07,1,0,comentario,Neutro
Detran,"Examinador do Detran me reprovou por um item que nem existe no regulamento, como proceder? Fiz hoje prova prática de carro do Detran RJ no aerotown, a baliza foi perfeita, porém na hora de ir ao percurso não virei antes o volante e acabei me atrapalhando um pouco no volante , mas retomando o controle do veículo logo em seguida. Ele disse que perdi o controle do veículo e me deu 3 pontos. Até aí ok, dei mole.   Porém logo em seguida continuei, passei a segunda marcha, liguei a seta pra direita e ",karterbr,u/karterbr,2025-07-11T17:12:56,7,27,post,Insatisfeito
Detran,"Infelizmente, não tem nada que você possa fazer. É a sua palavra contra a dele e o detran não fornece meios de recorrer a decisão.",NightmareOfTheTankie,u/NightmareOfTheTankie,2025-07-11T18:28:27,12,0,comentario,Neutro
Detran,"Esse exame do DETRAN devia ser abolido, isso na capacita ninguém.  O cara precisa ensaiar o teste como se fosse para um concurso de Dança.",Chemical_Primary_144,u/Chemical_Primary_144,2025-07-11T17:46:42,21,0,comentario,Neutro
Detran,"Cara, acho que o esquema é entrar nessas provas com gravador ligado. Se conseguir usar uma ""caneta espiã"", melhor ainda. Sei que não é geral (eu mesmo passei de primeira na minha de carro; na de moto passei de segunda porque na primeira realmente cometi falta eliminatória), mas ouço cada história dessas provas...   Talvez ele tenha considerado isso como dirigir sem atenção (artigo 169 do CTB), mas aí eu acharia bizarro - se ele pode dar a interpretação de que olhar para a marcha (que você disse ",numseiquemsou,u/numseiquemsou,2025-07-11T17:54:09,4,0,comentario,Neutro
Detran,Teu erro foi não ter mamado ele,Designer_Holiday3284,u/Designer_Holiday3284,2025-07-11T17:49:06,8,0,comentario,Insatisfeito
Detran,"""Brasil não é pobre à toa. Isso aqui é trabalho de profissional"" Ouvi essa frase do Marcos Lisboa no último vídeo do [Manual da Economia](https://www.youtube.com/@manualdaeconomia) e não consigo parar de pensar nela.  Tipo, costumava ficar puto quando veia uma coisa completamente sem sentido. Mas agora, fico pensando ""boa, quem fez essa merda mandou bem, atrapalha muito a gente mesmo. Parabéns"".  Comecei a enxergar tudo como parte de um sistema que funciona perfeitamente… pra quem precisa que dê",ParkInsider,u/ParkInsider,2025-06-19T15:28:17,649,89,post,Insatisfeito
Detran,"Eu tive a certeza de q o brasil te força a ser pobre quando uma comida produzida aqui no brasil, é mais cara do que a mesma comida, sendo levada daqui e comercializada nos eua e mesmo convertendo de dolar pra real ela é mais barata lá.",SuperKeyboardUser,u/SuperKeyboardUser,2025-06-19T15:45:01,132,0,comentario,Neutro
Detran,Os vídeos do Manual de Economia são dolorosos de se assistir. O vídeo sobre o judiciário me deixa até hoje irado de raiva.,Desconhecido,u/Desconhecido,2025-06-19T15:37:14,134,0,comentario,Insatisfeito
Detran,"Marcos Lisboa é de (muito) longe um dos melhores liberais do país. Não necessariamente concordo com a visão de mundo, mas de fato tem muita coisa que é feita no Brasil para que nós *sequer* consigamos chegar ao nível de uma economia capitalista de alta produtividade. Parte disso é externo (divisão internacional do trabalho), parte é interno (uma elite rentista e de herança escravagista, de baixíssima qualidade e que não se enxerga como brasileira).",Much_Ad_9903,u/Much_Ad_9903,2025-06-19T16:02:29,51,0,comentario,Satisfeito
Detran,">a prova psicométrica do DETRAN  Isso é algo que eu acho bem curioso. Até onde eu pesquisei quase nenhum outro país aplica um teste de desenhar pauzinhos como requisito para poder dirigir. E a observar pelos resultados, está fazendo um péssimo trabalho de filtrar motoristas ruins.",NightmareOfTheTankie,u/NightmareOfTheTankie,2025-06-19T17:53:23,11,0,comentario,Insatisfeito
Detran,"Consegui reverter uma multa do Detran com a ajuda do ChatGPT e ainda ganhei 800 reais Recebi uma multa do Detran que não fazia o menor sentido, era claramente ilegal. Fui atrás de advogado, mas os preços eram absurdos, ninguém cobrava menos de mil reais pra fazer minha defesa. Como eu tava sem grana pra isso, lembrei de umas histórias que já vi de gente usando o ChatGPT pra resolver problema e pensei em tentar com isso mesmo.  Usei o ChatGPT pra montar minha defesa pro processo administrativo no",Adept-Type,u/Adept-Type,2024-12-24T09:17:06,2795,139,post,Satisfeito
Detran,"Uma vez vi um cara receber multa por andar sem capacete, detalhe que a multa foi aplicada num Corolla.",PipocaAgiota,u/PipocaAgiota,2024-12-24T10:25:32,529,0,comentario,Neutro
Detran,Os 18937338 advogados por habitantes no Brasil chegam a tremer,juarezselvagem,u/juarezselvagem,2024-12-24T09:46:12,1092,0,comentario,Neutro
Detran,"No juizado especial e na trabalhista, por não precisar necessariamente de advogado, você pode apenas relatar o que aconteceu de forma simples. Não precisa necessariamente de chatgpt ou de modelos (mas ajuda se tiver). O principal é explicar com suficiente clareza o que você quer e o que pretende pedir. Isso você já precisa fazer com o chatgpt, ou nem a IA vai entender o que houve.",Jaodarneve,u/Jaodarneve,2024-12-24T09:36:34,417,0,comentario,Neutro
Detran,Pra peças juridicas recomendo o Claude (se n for pagar o chatgpt),phewho,u/phewho,2024-12-24T10:00:15,71,0,comentario,Satisfeito
Detran,"Eu comecei a estudar matemática de novo a nível universitário esse ano e é absurdo o como o ChatGPT consegue te ajudar. Sem contar a quantidade de material online, principalmente no YouTube, que te ajuda acompanhar o conteúdo.  Isso foi um choque de realidade muito grande pra mim por que só fazem 10 anos que me formei. Tá muito fácil ter autonomia sobre o teu aprendizado e não precisar depender de professor. Tu pode aprender tudo no teu ritmo.  Muita gente zoa IA (e com razão), mas existe defini",catcherfox7,u/catcherfox7,2024-12-24T10:22:19,45,0,comentario,Satisfeito
Detran,Detran perde prazo e mais de 17 mil condutores não terão aberto processo de cassação da carteira de motorista no RS | GZH,Intelligent-Look-580,u/Intelligent-Look-580,2024-12-12T11:24:39,43,4,post,Neutro
Detran,"#[Não consegue abrir a notícia? Leia aqui.](https://12ft.io/https://gauchazh.clicrbs.com.br/colunistas/jocimar-farina/noticia/2024/12/detran-perde-prazo-e-mais-de-17-mil-condutores-nao-terao-aberto-processo-de-cassacao-da-carteira-de-motorista-no-rs-cm4k3g1dv00pe013n60f4qn71.html)  Apoie o jornalismo brasileiro, [assine o jornal](https://caiowzy.github.io/pulaCerca/assine?origem=https://gauchazh.clicrbs.com.br/colunistas/jocimar-farina/noticia/2024/12/detran-perde-prazo-e-mais-de-17-mil-condutor",AutoModerator,u/AutoModerator,2024-12-12T11:24:40,1,0,comentario,Neutro
Detran,Presente de Natal para os piores motoristas do país,User4f52,u/User4f52,2024-12-12T12:01:39,23,0,comentario,Insatisfeito
Detran,O Detran ganha alguma coisa com isso?,the_most_humble_man,u/the_most_humble_man,2024-12-12T17:09:33,8,0,comentario,Neutro
Detran,"Menos papelada, quem perde é a sociedade",happy_and_sad_guy,u/happy_and_sad_guy,2024-12-12T19:44:37,3,0,comentario,Neutro
Detran,"Reprovado no Detran pelo ""carro fantasma"" Meu irmão tá tirando carteira e hoje ele reprovou na prova prática por, segundo o avaliador, ter batido no carro fantasma ao estacionar. Ele passou na baliza, dirigiu de carro algumas quadras e o avaliador mandou ele estacionar, depois de estacionar o avaliador falou que ele bateu no carro fantasma e tava reprovado, não  tinha cone nem linha indicando onde ele devia estacionar. A prova foi feita em Tubarão-SC, é real isso ou só tão passando a perna?",galvarro26,u/galvarro26,2024-10-08T17:55:47,33,24,post,Neutro
Detran,"Eu falo ou vocês falam? Tá bom, eu falo: ele quer propina! 😂🤣",Marxelon,u/Marxelon,2024-10-08T18:55:19,48,0,comentario,Satisfeito
Detran,"É obrigatório ter alguma indicação de aonde estaria os outros carros na prova de baliza, seja com cones ou com algum outro tipo de obstáculo. O avaliador passou a perna no seu irmão, provavelmente para pedir suborno para passar ele.",random-user-492581,u/random-user-492581,2024-10-08T18:13:42,55,0,comentario,Neutro
Detran,"É, parceiro... Tão te passando a perna. Se fosse eu já ia mandar ""Mas se o carro é fantasma não tem como tocar nele, porra"" kkkkkkk",Beautiful_Piccolo_51,u/Beautiful_Piccolo_51,2024-10-08T18:37:18,29,0,comentario,Insatisfeito
Detran,"Uma vez eu reprovei por que passei de uma linha invisível indicada apenas pelo trajeto do celular do cara, eles tinha mudado o trajeto e não colocaram as marcas no chão e não falaram nada.  Outra vez eu reprovei pq o carro morreu, mas não foi eu, o carro realmente parou de funcionar, e ele não conseguiu ligar pro próximo candidato, e ainda tive que pagar pra fazer outra.  Na real, é mais fácil pagar pra tentar de novo do que se envolver numa treta pra ir contra isso....",Belerofonte_,u/Belerofonte_,2024-10-08T18:19:59,12,0,comentario,Neutro
Detran,Cara  bateu no carro do Patrick Swayze.,Rimjobquarterback420,u/Rimjobquarterback420,2024-10-08T19:28:48,6,0,comentario,Neutro
Detran,"Teste psicotécnico do DETRAN não serve pra nada Eu explico o motivo da minha afirmação:  - O Brasil é [MEDALHA DE BRONZE](https://www.metropoles.com/brasil/ranking-tragico-brasil-e-3o-pais-que-mais-registra-mortes-no-transito) em mortes no trânsito, ficando atrás apenas de Índia e China, países com mais de um bilhão de pessoas! Onde está o filtro do teste? Estamos na frente de países da América Latina que sequer obrigam os motoristas a fazerem aulas de direção.  - O teste joga a culpa da irrespo",Mina_Autista,u/Mina_Autista,2024-09-11T17:03:41,49,29,post,Neutro
Detran,"Quando fiz, reprovei e fui chamado pra uma entrevista, q tive q pagar mais uma taxa. Aí me passaram. Tive a impressão de ter passado no exame de recuperação, kkkk. Nunca entendi o motivo de terem me reprovado na primeira e sempre desconfiei q foi só para arrecadar uma taxa extra. Isso já faz 20 anos e nunca bati o carro. De resto, é bem difícil acreditar que os testes realmente avaliam algo. Se alguém tiver alguma publicação de revista científica séria dizendo que os testes funcionam, por favor ",Acrobatic_Wait_973,u/Acrobatic_Wait_973,2024-09-11T17:15:18,16,0,comentario,Neutro
Detran,"O teste é só um dos mecanismos de formação de condutores, ele não é definitivo. Seria talvez até mais coerente você dizer que o trabalho prático é ruim a não ser que você esteja insinuando que a maior parte dos acidentes de trânsito tem a ver com algum tipo de déficit psicológico.",AchacadorDegenerado,u/AchacadorDegenerado,2024-09-11T18:39:19,6,0,comentario,Neutro
Detran,"Porque o objetivo é dinheiro, não formar bons condutores.  Se você reprova no psicotécnico é **só pagar uma taxa** e pegar a carteira.",Used-Ad4276,u/Used-Ad4276,2024-09-11T17:33:24,36,0,comentario,Neutro
Detran,"Acho que não estão entendendo o objetivo do psicotécnico também. Ele não é classificatório, não são os melhores que passam, mas sim um método pra avaliar pessoas, que em situação alguma, têm condições de serem habilitados. É como se fosse um exame de rastreio para barrar aquelas pessoas que, em função de algum motivo (atraso cognitivo severo, por exemplo) não podem dirigir. Existem as situações limítrofes que são os exemplos que vemos comumente, pessoas independentes, as vezes muito ansiosas, qu",tapevhs,u/tapevhs,2024-09-11T20:20:41,7,0,comentario,Insatisfeito
Detran,"Um instrutor da auo escola certa vez disse na aula ""psicotécnico não diz muita coisa, até o maníaco do parque passou""",yuricomg,u/yuricomg,2024-09-11T17:36:57,5,0,comentario,Neutro
Detran,"Exame Prático do Detran MS - Carro. Bom dia galera.  Terminei minhas aulas práticas de carro da Auto Escola. Meu instrutor quer que eu faça mais 10 aulas custando quase R$900,00 e eu não tenho esse dinheiro esse mês. Queria acabar logo com isso, Eu sinto seguro em dirigir e fazer tudo o que pedem para fazer, mas queria saber de vocês. O que vocês fariam? Compro as aulas ou já faço o exame? Se alguém me disser como é, pelo menos já fico precavido aqui kkk.     Abraço a todos.",oissac4991,u/oissac4991,2024-08-14T08:47:14,7,14,post,Satisfeito
Detran,"Se você se sente seguro para o exame, não faz sentido desembolsar R$900 lulacoins nessa máfia que é o Detran",monkcrow,u/monkcrow,2024-08-14T09:00:22,8,0,comentario,Satisfeito
Detran,"Já fazem uns anos desde que fiz, mas foi assim:  1 - Fomos lá no lugar das balizas e não teve segredo, tu tem que fazer ela bonitinho dentro do tempo sem derrubar os cones ou subir o pneu na guia.  2 - Teste prático foi um percurso rápido, menos de 10 minutos, cuidado com as placas de sinalizações e nos cruzamentos tem que parar antes (coisa de 1-2 metros)e ir avançando aos poucos até ter visão clara do tráfego, se deixar para parar em cima do cruzamento  os fiscais vão brecar seu carro e te tir",M_Uhde,u/M_Uhde,2024-08-14T09:33:39,4,0,comentario,Satisfeito
Detran,"O cara quer vender mais aula pra ti. Eu fiz a prova e passei de primeira, sem fazer aulas adicionais. Eu faria o exame se fosse vc.",Codhehe5555,u/Codhehe5555,2024-08-14T09:31:26,3,0,comentario,Neutro
Detran,Faz o exame e refaz as aulas se for muito mal.,rickccb,u/rickccb,2024-08-14T10:33:24,2,0,comentario,Neutro
Detran,"Problemas com instrutor maluco da auto escola Estava fazendo aulas práticas de carro em uma auto escola da minha cidade, nesse auto escola eu também fiz a prova teórica e passei de primeira, peguei o pacote da carteira simultânea A e B para as aulas práticas e ae que veio os problemas. Demorou 3 meses para marcarem minha aula de carro, e ainda tive que ir com meu pai lá para resolver, e antes disso me disponibilizaram 2 horários de manhã que eu tinha avisado que não poderia devido a minha faculd",KonradKaick,u/KonradKaick,2024-06-20T13:52:55,13,20,post,Insatisfeito
Detran,Eu já tinha mandado tomar na peida e mudado de instrutor ou pedido reembolso,JustAnotherALGOnaut,u/JustAnotherALGOnaut,2024-06-20T14:06:09,14,0,comentario,Neutro
Detran,"O cara pode alegar o que quiser: está prestando um serviço e está sendo pago pra isso. Que preste bem,  Pra mim, tá com cara de que essa auto escola não tem opções pra te dar e tá presa com esse cretino.     Veja se dá pra trocar e já mete o DETRAN no meio.",RPandorf,u/RPandorf,2024-06-20T14:41:44,11,0,comentario,Neutro
Detran,"Pro tip: se você raspar o carro da autoescola em um Porsche, você não pode ser responsabilizado.",Mr_Slime_,u/Mr_Slime_,2024-06-20T15:46:27,11,0,comentario,Neutro
Detran,"Se você não quiser aprender a dirigir e ficar traumatizado, você continua com esse instrutor. Se quiser aprender a dirigir, troque. Ninguém precisa de grito pra aprender.",little_banhita,u/little_banhita,2024-06-20T14:47:49,10,0,comentario,Neutro
Detran,"Só troca, e após concluir o processo, abre uma reclamação formal na auto escola e no Detran ",lcerbaro,u/lcerbaro,2024-06-20T14:17:25,6,0,comentario,Neutro
Detran,"Caminhão do MSTS que transportava marmitas é guinchado pela brigada militar de Porto Alegre. Um caminhão da cozinha solidária do MTST que levava marmitas às vítimas das enchentes no Rio Grande do Sul foi guinchado pela Brigada Militar de Porto Alegre nesta segunda-feira (20/5).   O veículo, que transportava mais de 3 mil marmitas, foi guinchado por não ter pago a taxa do licenciamento. Segundo o MTST, o valor não foi pago devido ao site do DETRAN-RS estar inoperante.   Após a abordagem do veícul",hypercinetic,u/hypercinetic,2024-05-21T13:10:24,413,39,post,Neutro
Detran,"Obrigado por postar no r/brasil.    Venha conhecer nossa instância no Lemmy: https://lemmy.eco.br/  ***  [**Perguntas Frequentes**](https://lemmy.eco.br/post/85).  ***   *I am a bot, and this action was performed automatically. Please [contact the moderators of this subreddit](/message/compose/?to=/r/brasil) if you have any questions or concerns.*",AutoModerator,u/AutoModerator,2024-05-21T13:10:42,1,0,comentario,Satisfeito
Detran,Se quem manda na polícia colosse elas perto de baladas e bares já faria um melhor trabalho para a sociedade ao pegar riquinhos dirigindo embriagados.,4dasilva123,u/4dasilva123,2024-05-21T14:07:14,103,0,comentario,Neutro
Detran,"Mesmo que fosse anos de atraso, guinchar um veículo desse neste momento já seria ridículo por si só, mas piora:  >O movimento alegou que o veículo estava regularizado até 30 de abril e questionou o governo estadual, que prorrogou por tempo indeterminado o prazo de pagamento de infrações, em razão do estado de calamidade pública, pela Portaria 177/2024 do DetranRS. Com isso, o veículo foi liberado, segundo a deputada estadual Laura Sito (PT), que se manifestou nas mídias sociais",brunomocsa,u/brunomocsa,2024-05-21T21:20:01,53,0,comentario,Insatisfeito
Detran,"Cadê o Pablo Marçal, SBT, e galera do mimimi “extrema direita”? Que denuncia este casos",Fit-Opposite6238,u/Fit-Opposite6238,2024-05-21T17:02:08,88,0,comentario,Neutro
Detran,Cadê Marçal denunciando isso?,Desconhecido,u/Desconhecido,2024-05-21T16:46:43,43,0,comentario,Neutro
Detran,"Renovação CNH após voltar ao Brasil Olá, morei muitos no exterior e recentemente voltei ao Brasil e preciso renovar minha CNH vencida (venceu 8 anos atrás). Preciso levar algum documento adicional como passaporte , ou é possível renovar normalmente ? Ou perdi a carteira e tenho que fazer tudo do zero? É DETRAN do Paraná .",SushiSuxi,u/SushiSuxi,2024-05-08T10:28:18,1,5,post,Neutro
Detran,"Eu acabei de fazer algo parecido. No meu caso estava 7 anos vencida. No Detran RN me disseram q depois de 5 anos vencida tem que fazer uma prova de atualização.  Fiz a prova no mesmo dia, não precisei de aula e nem nada, só folheei o material no site do Detran. A prova é só teórica e o conteúdo é só direção defensiva e primeiros socorros. Fiz a prova em menos de 10min. No mesmo dia já sai com a CNH digital.",jCraveiro,u/jCraveiro,2024-05-08T11:53:20,4,0,comentario,Neutro
Detran,"Renovei a minha com mais de 2 anos de vencida sem problemas... Não deve dar problema, Faça a solicitação online, pague a guia e agende o exame: [https://www.detran.pr.gov.br/servicos/Motorista/Carteira-de-motorista/Solicitar-a-renovacao-da-carteira-de-motorista-MD3PAr6a](https://www.detran.pr.gov.br/servicos/Motorista/Carteira-de-motorista/Solicitar-a-renovacao-da-carteira-de-motorista-MD3PAr6a)",CrazyTrain36,u/CrazyTrain36,2024-05-08T11:38:57,2,0,comentario,Satisfeito
Detran,Muito obrigada pela explicação. Você agendou para ir ao detran ou foi direto ao balcão de atendimento ?,SushiSuxi,u/SushiSuxi,2024-05-08T15:30:06,1,0,comentario,Neutro
Detran,"No Detran RN precisava de agendamento, aí já não sei dizer como é no Paraná",jCraveiro,u/jCraveiro,2024-05-08T15:51:37,1,0,comentario,Neutro
