servico,texto,autor,usuario,data,curtidas,comentarios,tipo,sentimento
Cleric,"Stupid character concept? Hi so basically I have this funny idea to play a ""cleric"" who ""worships"" Ao. Of course id have no powers, so he's basically just a bad fighter? Or a type of paladin? Idk. I just think it would be pretty funny?",Striking_Hat_8176,u/Striking_Hat_8176,2025-09-28T06:06:39,15,68,post,Neutro
Cleric,There’s a bunch of those in the Shadows of Undrentide expansion to Neverwinter Nights. It’s kinda funny—they basically just get stoned on wine and “meditate” on the existence of AO all day.,alesplin,u/alesplin,2025-09-28T06:13:05,24,0,comentario,Neutro
Cleric,Wasn't there something about Ao not wanting priests and smiting those who worship him?,ArkanZin,u/ArkanZin,2025-09-28T06:20:44,13,0,comentario,Neutro
Cleric,"Do it as a Paladin. Your conviction to follow a god who doesn't want your worship is so strong, you end up wielding divine magic, anyway, much to Ao's annoyance.",HemaMemes,u/HemaMemes,2025-09-28T08:47:57,20,0,comentario,Neutro
Cleric," we had that in 2e , use a fighter or arcane caster",ThoDanII,u/ThoDanII,2025-09-28T07:28:02,5,0,comentario,Neutro
Cleric,"Others have suggested monk or paladin, which are both good options for a non-cleric priest type.   The other option, if your GM is game: a warlock who believes he is a cleric of Ao. Look, I pray to Ao, and he grants me magical powers, see?  I mean it's obvious - if Ao isn't answering my prayers, who is?",michiplace,u/michiplace,2025-09-28T09:27:00,6,0,comentario,Neutro
Cleric,"Oghma in Canticle I just started reading Canticle and there's a scene early on referencing Oghma that's confusing me.     ""Years of of meditation and training had honed Danica's reflexes and muscles to a fine fighting edge, *as the clerics of Oghma, fancying themselves great wrestlers in the image of their god figure*, were painfully discovering one after another.""    Oghma is the god of knowledge and depicted as a bard or wizard. Why would his clerics focus on physical strength? And can't find ",WhiteToast-,u/WhiteToast-,2025-09-27T22:28:48,27,11,post,Satisfeito
Cleric,"It is mentioned in passing in *Faiths & Avatars*, the 2e supplement, which came out 5 years after *Canticle*.  The mention is on page 133, discussing one sort of Oghmanyte priest: the Lorekeepers. It says: “Lorekeepers can use weapons in combat but are most comfortable wrestling, a type of combat at which their deity is excellent.” It follows up with a variety of different mechanical ways to implement this, which aren’t relevant to this lore discussion.   However, this, I believe, stems from 1e’",Impressive-Compote15,u/Impressive-Compote15,2025-09-27T22:41:49,25,0,comentario,Satisfeito
Cleric,It always amazes me when Salvatore actually finds a piece of lore and uses it. This is from page 29 of 2E's Forgotten Realms Adventures in the section on specialty priests:  https://preview.redd.it/4vxnb2siztrf1.png?width=418&format=png&auto=webp&s=183c44e1211cc2fe6d60d0517ff63ee00be26b3a,The-Wyrmbreaker,u/The-Wyrmbreaker,2025-09-28T01:14:42,14,0,comentario,Neutro
Cleric,"That was flavor in 1e which I think was phased out. It’s very likely a reference to Plato, the Greek philosopher whose name means broad (shouldered) and was known for his strength & wrestling ability.",MythicalPurple,u/MythicalPurple,2025-09-28T00:24:22,8,0,comentario,Neutro
Cleric,"Oghma, The Earth deity was a wrestler.  So it only makes sense he is like that in the Realms.  Of course, sadly, WotC has been reducing all the Realmslore starting with 3E.  The idea of physically fit scholars doing martial arts is a common thing, even in our world.  Also, technically wrestling does not focus on pure 'strength'.",BloodtidetheRed,u/BloodtidetheRed,2025-09-28T13:47:51,3,0,comentario,Neutro
Cleric,https://preview.redd.it/mrkrd3mvd1sf1.png?width=500&format=png&auto=webp&s=cc0a28887ffccdf5f7da5d68c15ba953329b9002  Out of spells is not out of options for the prepared,Alodora01,u/Alodora01,2025-09-29T02:05:56,3,0,comentario,Neutro
Cleric,"Revised Deities (3.5e): Labelas Enoreth, Lord of the Continuum **LABELAS ENORETH**   *The Lifegiver, Lord of the Continuum, the One-Eyed God, the Philosopher, the Sage at Sunset*   **Intermediate Power of Arborea**   **Symbol** A setting sun   **Realm** Arvandor \[the Vanishing Tower\] (Arborea/Olympus)   **Alignment** Chaotic Good   **Aliases** Chronos, Karonis, Kronus, the Simbul   **Superior** Corellon Larethian   **Allies** Chronepsis, Cyrrollalee, Deneir, Eilistraee, Milil, Mystra, Oghma, S",LordofBones89,u/LordofBones89,2025-09-26T23:19:05,4,4,post,Satisfeito
Cleric,"Presumably the Elflore feat could be adapted to a Faerunian version, replacing ""Oerth"" with ""Faerun"" in the description and selecting regional requirements appropriately? Because as it stands, it's still written for a Greyhawk campaign.",Pharmacy_Duck,u/Pharmacy_Duck,2025-09-27T03:59:07,1,0,comentario,Neutro
Cleric,"Sure; refluffing the feat shouldn't be a problem. Just change the regions to Evermeet, Cormanthyr, and whatever other elven kingdoms you want.",LordofBones89,u/LordofBones89,2025-09-27T04:03:04,2,0,comentario,Neutro
Cleric,"This is no denigration of your very impressive work here, by the way, but it's incredibly sloppy of whoever put up the list of feats on the Realmshelps site that quite a few of them are either still tailored for the campaign they were written for, or aren't narratively usable in the Realms at all.",Pharmacy_Duck,u/Pharmacy_Duck,2025-09-27T04:16:42,1,0,comentario,Neutro
Cleric,"That requires editing and rewriting, not simply copying.",Sahrde,u/Sahrde,2025-09-27T19:46:24,1,0,comentario,Neutro
Cleric,Which FR novels would you like to see get an animated or live action adaptation? I'm partial to the Finder's Stone trilogy and the Cleric Quintet.,ThanosofTitan92,u/ThanosofTitan92,2025-09-25T13:05:21,15,38,post,Neutro
Cleric,Icewind Dale would make a pretty great show.,zero_divisor,u/zero_divisor,2025-09-25T13:20:58,25,0,comentario,Satisfeito
Cleric,The Avatar trilogy + Prince of Lies.,Pharmacy_Duck,u/Pharmacy_Duck,2025-09-25T13:10:08,14,0,comentario,Neutro
Cleric,I could see the Brotherhood of the Griffon stories making a good series.,Argentfire,u/Argentfire,2025-09-25T13:17:39,9,0,comentario,Neutro
Cleric,War of the spider queen please.,bluehope2814,u/bluehope2814,2025-09-25T13:34:22,9,0,comentario,Neutro
Cleric,"Icewind Dale. It has everything needed for mass appeal and if it takes off, then they can figure out how to make the Dark Elf trilogy.",SirUrza,u/SirUrza,2025-09-25T13:32:40,15,0,comentario,Neutro
Cleric,"Wendonai as a Warlock Patron - what would they want? First off if you're playing a Freth noble, stop reading!  I'm DMing a game for a solo player, he's playing a male drow noble in Menzoberranzan, its a sandbox style game so he's pursuing his own goals mostly while I provide obstacles and optional quests. I've got a lot of political intrigue and stuff going on, but one thing I am seriously lacking is interaction with his patron; he is a fighter/warlock and after some discussion in session zero w",Athan_Untapped,u/Athan_Untapped,2025-09-25T12:51:16,0,3,post,Satisfeito
Cleric,He is allies with Eltab and was banished by a priest of mulhorand. Specifically Horus-re for two thousand years. So bringing that nation down would make him happy.  He wants vengeance. He's also the champion of Lolth.,CraftyAd6333,u/CraftyAd6333,2025-09-25T14:29:26,4,0,comentario,Neutro
Cleric,Patron warlock relationships aren’t really required to take any one form. Patrons can’t directly control their warlock or even deprive them of power by default. In fact a warlock could be working directly against the patron even. Ultimately a player and a DM should work together to define what the pact entails and I would just ask your player what kind of relationship he is interested in. 5e and 5.5 deliberately moved away from hard restrictions like clerics being depowered by their deities. Onl,Realistic_Swan_6801,u/Realistic_Swan_6801,2025-09-25T14:44:05,3,0,comentario,Neutro
Cleric,"A warlock is, effectively, a cleric type servitor for non-gods, so it makes sense that there are overlapping style quests.    Given Wendonai's history, maybe he needs something retrieved from an elven ruin in The North, one where his worship/adoration/ritual mating with the [Ilythiiri](https://forgottenrealms.fandom.com/wiki/Ilythiiri) ruling houses happened.  Possibly it contains some nebulous amount of power he wants to regain, or maybe it's an artifact that contains power from sacrifices.  Ma",Sahrde,u/Sahrde,2025-09-25T13:33:48,0,0,comentario,Neutro
Cleric,"What are your thoughts on Druzil, the little devil from the Cleric Quintet? https://villains.fandom.com/wiki/Druzil  I think Salvatore confused Imps with Quasits.  Druzil is a Imp (lawful evil devils), and yet he's described as a creature of chaos.  Still a funny little bugger.",ThanosofTitan92,u/ThanosofTitan92,2025-09-24T17:04:22,26,8,post,Insatisfeito
Cleric,"This series was written (or at least started) during 2nd edition.   This edition specifically did not have any concept of “devil”. While imps were still technically lawful evil, they were somewhat mischievous, winged things.  The rigid a devil is utterly lawful, and a demon is a ball of chaos thing didn’t exist at all in that edition (as a reaction to the tone of the 1980s and some very vocal people). The word devil was never used, and it’s been 30 years ago, but to the best of my memory demon w",ferzerp,u/ferzerp,2025-09-24T18:33:01,8,0,comentario,Neutro
Cleric,"I've named every im in charge of ""Druzil""",silverjudge,u/silverjudge,2025-09-25T00:16:49,3,0,comentario,Neutro
Cleric,"So imps in 2e weren’t devils. They weren’t part of the infernal hierarchy and probably didn’t even originate from there, although it’s pretty vague simply saying they’re from the lower planes. However, imps definitely were still lawful evil back then, so him being chaotic and working for a chaotic goddess to release a chaos curse was weird.   Also, at one point he turns into a centipede, which is something quasits can do and not imps. So I think you’re right.",Genghis_Sean_Reigns,u/Genghis_Sean_Reigns,2025-09-25T01:36:15,3,0,comentario,Insatisfeito
Cleric,"Not quite true.  While 2E omitted the planar creatures at the beginning of its publication, they were published before the first book of the Cleric Quintet was released.  It's just Salvatore botching his lore as he does all too often.",The-Wyrmbreaker,u/The-Wyrmbreaker,2025-09-24T19:20:40,6,0,comentario,Neutro
Cleric,The terms devil and demon were used in 1e. 2e replaced them with baatezu and tanar’ri respectively but everyone knew what they were. Devils being also and demons being chaotic was definitely a thing.,Genghis_Sean_Reigns,u/Genghis_Sean_Reigns,2025-09-25T01:33:58,2,0,comentario,Neutro
Cleric,"Why clerics of evil gods can heal lorewise? Just always was curious about that. I'm new to FR setting and dnd and i know that there are cosmic forces of good and evil, positive (healing) energy and negative (harmful) energy. I played some old crpgs where evil, neutral and good clerics had slightly different spell lists but clerics of evil gods still had ability to use positive energy to heal (it's not the case for 5e as i know). And it means that this positive energy is granted by their patron d",Fabulous_Ratio4892,u/Fabulous_Ratio4892,2025-09-21T16:41:30,28,65,post,Neutro
Cleric,"Healing is a neutral act, it's not necessarily good or evil.",BlueHero45,u/BlueHero45,2025-09-21T16:47:18,90,0,comentario,Neutro
Cleric,"Because even bad guys have allies that they need to keep alive.    Even in 3.x/Pathfinder, where clerics could channel positive/negative energy (depending on alignment), it didn't affect \*spells\*.    Good clerics could theoretically prepare Cause Wounds spells as well. It's just frowned upon.",Sahrde,u/Sahrde,2025-09-21T16:45:24,36,0,comentario,Neutro
Cleric,A priestess of Loviatar inflicts suffering on the congregation. She then heals them so that they can experience it all over again for the glory of Loviatar,priestessofcthulhu,u/priestessofcthulhu,2025-09-21T16:55:31,26,0,comentario,Neutro
Cleric,"because healing is not about ""negative"" or ""positive"" energies",fox112,u/fox112,2025-09-21T16:42:52,31,0,comentario,Neutro
Cleric,"A good minion is hard to replace, it needs to be healed.",SirUrza,u/SirUrza,2025-09-21T16:54:51,9,0,comentario,Neutro
Cleric,"Do you have any suggestions for activities, games, and competitions worth prizes that could be featured at a Shieldmeet celebration fair? (__Note:__ This post contains spoilers from the beginning of Hoard of the Dragon Queen, literally from the beginning.)  __These first two paragraphs below serve only to provide context for why I'd like to add Shieldmeet to my campaign and can be skipped if you want to save time.__  Tyranny of Dragons is one of the 5th Edition adventures I'm most interested in ",GuardiaoDaLore,u/GuardiaoDaLore,2025-09-21T13:19:43,2,3,post,Insatisfeito
Cleric,"Which Area  Highland Games  Athletic and acrobatic Challenges? with or without armor  Bardic Grandprix de Eurovision, such are a staple trope",ThoDanII,u/ThoDanII,2025-09-21T13:43:00,1,0,comentario,Neutro
Cleric,"Casters inc. Bard - a talent show     Barbarian - axe throwing or drinking competition.     Fighters/Paladins - a joust or melee.     Rogue - shell game or cards being run by a cheat.      You can also think of things *going wrong* as challenges. Remember in Baldur's Gate (video game) there's The Great Gazib performance? He repeatedly summons an ogre to explode on stage, and eventually the ogre has enough and rampages.",becherbrook,u/becherbrook,2025-09-22T17:03:30,1,0,comentario,Satisfeito
Cleric,"Could you elaborate on what each of these games would be like? If possible, could you give an example of the possible prizes?",GuardiaoDaLore,u/GuardiaoDaLore,2025-09-21T14:40:38,1,0,comentario,Neutro
Cleric,"Revised Deities (3.5e): Iyachtu Xvim, the Godson of Bane **IYACHTU XVIM**   *The Godson of Bane, the Godson, the Son of Bane, the New Darkness, the Lord of Darkness, the Fiend-King, the Cruel Master*   **Lesser Power of Gehenna**   **Symbol** A pair of bright, glowing green eyes superimposed on the palm of an upright, human-shaped hand of utter blackness (Xvim Empowered) or (older) a pair of green, glowing eyes peering out of darkness   **Realm** Bastion of Hate (Gehenna/Chamada)   **Alignment**",LordofBones89,u/LordofBones89,2025-09-19T08:36:26,11,5,post,Satisfeito
Cleric,"Pretty cool, did you homebrew some lore as to how/why he'd still be around after the return of Bane? Or is that just from his time as deity between 1358 and 1372?",KhelbenB,u/KhelbenB,2025-09-19T10:35:57,4,0,comentario,Neutro
Cleric,Bane Junior,ThanosofTitan92,u/ThanosofTitan92,2025-09-21T07:33:32,1,0,comentario,Neutro
Cleric,"This is good old Icky when he was trying to live up to dear old dad, before Bane's return.",LordofBones89,u/LordofBones89,2025-09-19T10:38:35,4,0,comentario,Neutro
Cleric,"That makes sense, I was asking because I am considering bringing back Iyatchu as either a mortal or a demigod clutched at a morsel of divinity after Bane returned.   I know there was a popular theory back in the day that Bane never actually returned, it was just a lie by Iyatchu to consolidate power. It is not really what I'm considering, I prefer Iyatchu as a being/deity who is in way over his depth, but him being just fully dead is a bit of a shame. I already have Leira who canonically lied ab",KhelbenB,u/KhelbenB,2025-09-19T10:54:34,3,0,comentario,Neutro
Cleric,"I imagine that outside of the Tyrantfog, poor old Xvim was just screwed over at every step. Try to screw with Lathander? Paladine knew and trolled him the whole time. Try to usurp Beshaba? Ends up hiding while she punts the Bastion of Hate down Chamada. Try to take over the family business? Good luck when dear ol' dad pulls a chestburster.",LordofBones89,u/LordofBones89,2025-09-19T23:24:22,2,0,comentario,Neutro
Cleric,"How would you RP Tymora? I made a similar post a few months ago about Talos and I'm back once more for the wisdom of the subreddit.  I'm running a campaign that has some fairly direct divine intervention at points. So far the party has met Torm, Lliira, Lathander and Talos for various reasons, but the cleric in the party is a cleric of Tymora, who's been kind of conspicuously absent so far.  I'd like to find a way to work her into the upcoming chapter of our campaign where the players will be ex",ReveilledSA,u/ReveilledSA,2025-09-16T14:59:49,20,11,post,Neutro
Cleric,"She appreciates risk-takers. I'd have her respond favorably (not necessarily affirmatively) to unexpected and bold moves by the party. So if the horny bard asks her to join him for a drink? She might tell him he's cute and agree before drinking him under the table. If an aggressive dragonborn flourishes his sword and challenges her, she might send in a proxy to test his mettle, but not necessarily want to flatten him for his hubris.  Tymora likes to appear as the same race as whoever sees her - ",MageKorith,u/MageKorith,2025-09-16T15:23:58,19,0,comentario,Neutro
Cleric,"I made a little comic about Tymora talking with Gond when my PC became a cleric of theirs. I imagined Tymora (in this case appearing as a coin) talking in a lot of luck and gambling aphorisms. “I need to double down, you need to take a chance” and “as luck would have it…” and “fortune favours the bold.” You might find that fun for colour.",Special_Speed106,u/Special_Speed106,2025-09-16T16:16:46,8,0,comentario,Neutro
Cleric,"Tymora seems to have appeared in the last Acquisitons Incorporated series (co-DMed by Chris Perkins and Jeremy Crawford). A rosy cheeked halfling who called themselves the Archivist, iirc. I don’t think there was enough for you to go on there as inspiration but you could give it a try. Tymora is the mother (through an avatar) or Acq Inc’s Certainty Dran. Omin, one of the main PCs is the father)",Special_Speed106,u/Special_Speed106,2025-09-16T16:19:44,3,0,comentario,Neutro
Cleric,"She sort of only has half a personality due to being the result of a schism. Specifically, she's only the god of *good* luck. Unpredictable bad things are Beshaba's domain instead and form a distinct blind spot in Tymora's awareness. So the things she says to you are the things that gamblers say to themselves when they make grandiose promises to themselves and memory-hole all their losses. You're doing great. If you're winning, don't stop now, you're on a hot streak! If you're losing, don't stop",secretbison,u/secretbison,2025-09-16T18:18:59,3,0,comentario,Satisfeito
Cleric,Throw everyone for a loop and be midwestern nice.,29NeiboltSt,u/29NeiboltSt,2025-09-16T20:33:15,1,0,comentario,Neutro
Cleric,"Considering Tymora and Besheba are worshipped sorta as a duality, do any clerics exist as such or just one sided like most other deities clerics?",No-Channel3917,u/No-Channel3917,2025-09-12T17:56:17,29,23,post,Neutro
Cleric,"Not presently, no, because they're in direct opposition.  That said, they both emerged from the original deity of luck, Tyche, who split in half as a result of various events (there's a whole backstory on it suffice to say).   And with the way priests and divine magic works in the Realms, you would only ever get power from one or the other, not both. Anyone who thought they were, would likely either be getting it solely from one posing as both (likely Beshaba trying to stir up heresy or such), o",The_Lost_Jedi,u/The_Lost_Jedi,2025-09-12T18:12:19,25,0,comentario,Neutro
Cleric,"They aren’t worshipped together, they hate each other. You pick whichever one you think you need in the moment.",Realistic_Swan_6801,u/Realistic_Swan_6801,2025-09-12T18:16:06,7,0,comentario,Neutro
Cleric,"i believe there are both clerics of only tymora or only beshaba. fatemakers are mentioned in 4e as heretics who believe tymora and beshaba (and other luck or fate related deities) are one and the same and worship them as such. 3e mentions auspicians, which are closer to a philosophical cult more than anything with a heavy focus on the scripture of beshaba and tymora, but not inherently a religious organization i don't think. that's all i can think of.",raidenskiana,u/raidenskiana,2025-09-12T18:16:56,7,0,comentario,Neutro
Cleric,"They aren't typically worshipped together no, but they were literally the same goddess before the Dawn Cataclysm.  But of those who generally are, there is usually a direct hierarchy between the two. I'm thinking of Mystra+Azuth, Oghma+Deneir, Tempus+Red Knight, Sune+Sharess, etc.",KhelbenB,u/KhelbenB,2025-09-12T18:21:57,6,0,comentario,Neutro
Cleric,"From the Sword Coast Adventurer's Guide:  >""praying to both is thought to anger both goddesses.""  But yeah, I had the same idea. Halfling with the Luck feat, doesn't have to be a cleric. Holy symbol is a coin with a smiling lady on one side and antlers on the other side. Sounds like fun.",David_Apollonius,u/David_Apollonius,2025-09-12T18:21:20,3,0,comentario,Neutro
Cleric,"Question About Cleric Power Levels So, I'm running an Out of the Abyss game and the party will eventually visit Menzoberranzan.  I loved the dark elf trilogy, and many other R.A.Salvatore novels. I'm well versed in the drow, lolth and all that.  My question is simply: exactly how powerful are the clerics in Menzoberranzan in Canon?  In the drizzt novels the clerics have formidable training(Briza is a good example) in melee, and their snake headed whips are a combination of lethality and CC.  But",Euphoric-Teach7327,u/Euphoric-Teach7327,2025-09-11T14:14:24,18,8,post,Satisfeito
Cleric,"Bunch of spoilers, read at your own risk  >!At least Zhindia mentions that if her daughter's soul wasn't trapped by the dagger, she'd be able to cast True Resurrection for her even though her body was destroyed, and as it's 9th level spell, Zhindia must be at least lvl17.!<  >!And Zhindia is not even the most powerful cleric in the city, both Yvonnel, Quenthel, and Sos'Umptu are more powerful. Yvonnel and Quenthel are able to pull off MASS True Resurrection and Remove Curse on hundreds of people",Sunny_Hill_1,u/Sunny_Hill_1,2025-09-11T14:27:45,8,0,comentario,Neutro
Cleric,"You can find stat blocks for various drow enemies in the Monster Manual and in Mordenkainan’s Tome of Foes. The matron mother stat block, iirc, is a CR20 creature, so that’s the one you’d pick for the more powerful matron mothers of Menzo. For House Baenre, you’ll likely have to soup up some of those stat blocks. With some, you may have to find an equivalent stat block (i.e., bandit) and do a little splicing with the standard drow stat block.",PhoenixFeathery,u/PhoenixFeathery,2025-09-11T14:27:00,5,0,comentario,Neutro
Cleric,"Novels Are Not The Game.  They follow their own narrative rules.  You rarely got a book that came out and said that any given character cast a spell by name, just the effect.  You will often see characters in novels defeating opponents they never should have (or conversely, losing to foes that they shouldn't have) simply because the story is what's important there.  Plus, game wise, clerics don't have a lot of powerful offensive spells (whether they should or not is a different debate), so in st",Sahrde,u/Sahrde,2025-09-11T14:51:29,4,0,comentario,Neutro
Cleric,That drow city has about 20k drow.   You have lots of 5th thru 10th NPCs. And a decent amount of 15th thru 20.  It's not a place to invade,1933Watt,u/1933Watt,2025-09-11T16:49:23,5,0,comentario,Neutro
Cleric,"Well, the old Matron Mother Yvonnel Baenre was probably one of (if not the) highest single-class cleric in any published FR material in the current age, at Priest25 (2e). Only two clerics from Netheril were higher level.  And her daughter Quenthel follows her in this direction. Quenthel was level 19 in 3e, having since surpassed the former Matron (her sister Triel Cleric20), and even gaining Chosen of Lolth status in OotA. Now she's very likely comparable to Yvonnel at her prime.  >Hell, just fr",elturel,u/elturel,2025-09-11T14:39:27,4,0,comentario,Neutro
Cleric,"Gods' Champion class D&D 5e has a total of 13 classes, and each class offers many possibilities for subclasses, so that one Fighter can have a completely different playstyle from another Fighter, even though they share the same base class.  Consider this: each major deity in the Forgotten Realms universe chooses a Champion, who may or may not be a cleric. According to the dogmas of that deity and their personality, what would be the class and subclass of each of these Champions?",Yurohgy,u/Yurohgy,2025-09-11T10:03:02,15,19,post,Neutro
Cleric,"Are you asking about the Chosen for each god, or are you saying ""Champions"" are something different? The Chosen can be anyone as long as they exemplify that God's tenets and/or they work towards that God's goals. I honestly don't know what the exact percentage breakdown is, but the number of Chosen that are Clerics as a class has to be pretty low. I know a few of Mystra's Chosen had multiclassed Cleric per 3rd edition stat blocks, but overall I think the majority of Chosen aren't.  Tymora's chos",stormscape10x,u/stormscape10x,2025-09-11T11:32:06,3,0,comentario,Satisfeito
